{
  "aligned": null,
  "analysis": {
    "id": "structural-typed-alignment",
    "version": "1"
  },
  "artifactHash": "sha256:a54f3e02eda2e02308109e208c57c5d0489aeab25705798874e809f10393f1ae",
  "compatibility": {
    "basis": null,
    "reasons": [
      {
        "code": "cross-source-mapping-required"
      }
    ],
    "state": "unresolved"
  },
  "mapping": null,
  "policy": {
    "approval": "external-caller-allowance-not-self-asserted-by-mapping",
    "contentHash": "sha256:7bf83509995ef0a3b6e520596b674caacd0052148a0b09c4c2adb6f0d73bbb6c",
    "crossSource": "explicit-approved-mapping-hash",
    "id": "explicit-typed-vocabulary-alignment-v1",
    "mapping": "partial-bijection-per-field",
    "maxArtifactBytes": 1048576,
    "maxCanonicalizerCalls": 5,
    "maxMappingEntries": 1024,
    "maxSearchStatesPerCall": 100000,
    "missingCompatibility": "unresolved-no-aligned-values",
    "recanonicalization": "joint-fields-after-right-to-left-remapping",
    "requiredCoverage": "every-scoped-value-on-both-sides",
    "sameSource": "exact-model-binding-and-full-dictionary-hash",
    "targetVocabulary": "left-source",
    "version": "1"
  },
  "regime": {
    "contentHash": "sha256:5fe49b9439e107998e170cf8cf1e690598dfe8937321f5202ac4c2f270414868",
    "id": "typed-relations-v1",
    "version": "1"
  },
  "request": {
    "approvedMappingHash": null
  },
  "schemaVersion": "1",
  "sources": {
    "left": {
      "analysis": {
        "id": "structural-typed-observation",
        "version": "1"
      },
      "artifactHash": "sha256:adf2490fe49df874ccc25961c77624bf301befa9ebd16a474688ea25e4d42c79",
      "evaluation": "measured",
      "evidence": {
        "missing": [],
        "observedFieldCount": 5,
        "requiredFieldCount": 5
      },
      "implementation": {
        "contentHash": "sha256:953f5ae6ad1fee7069058ac66116848c7b3981850feaf9a1c84d216325ba60e3",
        "id": "typed-directed-observation-v1",
        "inputOrdering": "source-id-ascending",
        "kernelCanonicalSchemaVersion": "1",
        "kernelOperation": "canonicalizeCandidate",
        "missingScopedField": "null-typed-value-with-explicit-evidence-gaps",
        "otherAttributes": "excluded",
        "setEncoding": "canonical-json-string-of-numeric-sorted-distinct-integers",
        "sourceAudit": "all-present-fields-before-scoped-measurement",
        "valueEncoding": "node-count-and-directed-endpoints-with-five-joint-edge-fields",
        "version": "1",
        "vocabularyMeaning": "source-local-codes-require-separate-comparison-compatibility",
        "witnessMeaning": "one-common-bijection-not-canonical-orbits"
      },
      "observations": [
        {
          "availability": "observed",
          "implementation": {
            "contentHash": "sha256:953f5ae6ad1fee7069058ac66116848c7b3981850feaf9a1c84d216325ba60e3",
            "id": "typed-directed-observation-v1",
            "version": "1"
          },
          "observable": {
            "contentHash": "sha256:48f137781781c54724e172256925e44c9a2be42a08610c88abaca8a9f6016e7b",
            "id": "canonical-directed-structure-v1",
            "version": "1"
          },
          "regime": {
            "contentHash": "sha256:5fe49b9439e107998e170cf8cf1e690598dfe8937321f5202ac4c2f270414868",
            "id": "typed-relations-v1",
            "version": "1"
          },
          "value": {
            "edges": [
              {
                "from": 1,
                "to": 0
              }
            ],
            "nodeCount": 2
          },
          "valueHash": "sha256:af14f765b2d613defd32eac4a6cb9b097732662cdeba546b25c08a5d1700db42",
          "witness": {
            "candidateHash": "sha256:4f8fea889824f82d51d4a9550778d4d54ffc9719b6880a941319c706c9a28565",
            "edges": [
              {
                "from": 1,
                "sourceEdgeId": "e0",
                "to": 0
              }
            ],
            "nodes": [
              {
                "canonicalNode": 1,
                "sourceNodeId": "n0"
              },
              {
                "canonicalNode": 0,
                "sourceNodeId": "n1"
              }
            ],
            "skeletonHash": "sha256:3694eb0b4b385d431fb31657c1f6e8972e9d4dda81bfa422c6094816fc5824cd",
            "statistics": {
              "leaves": 3,
              "refinementRounds": 2,
              "searchStates": 3
            }
          }
        },
        {
          "availability": "observed",
          "implementation": {
            "contentHash": "sha256:953f5ae6ad1fee7069058ac66116848c7b3981850feaf9a1c84d216325ba60e3",
            "id": "typed-directed-observation-v1",
            "version": "1"
          },
          "observable": {
            "contentHash": "sha256:3df933040d1a5002b2338cf07b11eefd68e63f76597e72873d897fd3ea86efd3",
            "id": "canonical-typed-directed-structure-v1",
            "version": "1"
          },
          "regime": {
            "contentHash": "sha256:5fe49b9439e107998e170cf8cf1e690598dfe8937321f5202ac4c2f270414868",
            "id": "typed-relations-v1",
            "version": "1"
          },
          "value": {
            "edges": [
              {
                "from": 1,
                "to": 0,
                "types": {
                  "causalDirectionIds": [
                    0
                  ],
                  "dependencyTypeId": 0,
                  "interactionModeIds": [
                    0
                  ],
                  "necessity": "necessary",
                  "ontologicalRole": "arising"
                }
              }
            ],
            "nodeCount": 2
          },
          "valueHash": "sha256:bce3c524c7d09813659828f445677fdcc039c8121dd1359f3759ab5b6c9f4743",
          "witness": {
            "candidateHash": "sha256:e9bcdf4dc0f0761fea4c49672c752ef1c32cbca146ca694760233e137dabf877",
            "edges": [
              {
                "from": 1,
                "sourceEdgeId": "e0",
                "to": 0,
                "types": {
                  "causalDirectionIds": [
                    0
                  ],
                  "dependencyTypeId": 0,
                  "interactionModeIds": [
                    0
                  ],
                  "necessity": "necessary",
                  "ontologicalRole": "arising"
                }
              }
            ],
            "nodes": [
              {
                "canonicalNode": 1,
                "sourceNodeId": "n0"
              },
              {
                "canonicalNode": 0,
                "sourceNodeId": "n1"
              }
            ],
            "skeletonHash": "sha256:3694eb0b4b385d431fb31657c1f6e8972e9d4dda81bfa422c6094816fc5824cd",
            "statistics": {
              "leaves": 3,
              "refinementRounds": 2,
              "searchStates": 3
            }
          }
        }
      ],
      "preparation": {
        "analysis": {
          "id": "structural-regime-preparation",
          "version": "1"
        },
        "artifactHash": "sha256:431bb171bc59697abaa4bf61ae631990653f69df2ff92278594f2afeea99df90",
        "context": {
          "contextHash": "sha256:721f04b2a8ea3b9f380b649bbe2748c4b9ccd20b5db3cd723c6a8e23e3549b60",
          "dictionaryHash": "sha256:19e99088899e959ec8cdc75e442b071a99c5aa0f177b32574de84bcc40a2ab7f",
          "model": {
            "manifestHash": "sha256:5f79f8588b8923894aa1272f95b5b8ff9fd5af53f7c49e114044c033bd5fc33e",
            "modelId": "typed-single-edge",
            "modelRootHash": "sha256:1f5bbd840444da1d2f973372afe5952bfd63d8614dca382167176f92c6ce96c1",
            "modelVersion": "1"
          },
          "normalizationContext": "full-source-projection",
          "projectionPolicyHash": "sha256:25f5cdb778b7fdf05ff071dd9d8c672a9726ca50958a6192066e72a8523172d1",
          "schemaVersion": "1",
          "sourceProjectionHash": "sha256:ec68c9d2dda7bfd6bd2b9816d1e77df16648456595fcbb4519442950e54733a2"
        },
        "evaluation": "not-run",
        "observableSpecs": [
          {
            "contentHash": "sha256:48f137781781c54724e172256925e44c9a2be42a08610c88abaca8a9f6016e7b",
            "definition": "Canonical directed adjacency including isolated nodes, modulo node relabeling; all source attributes excluded.",
            "id": "canonical-directed-structure-v1",
            "mandatory": true,
            "normalization": "none",
            "requiredEvidence": [
              "verified-scoped-directed-projection"
            ],
            "schemaVersion": "1",
            "scope": "whole-scoped-directed-graph",
            "supplier": {
              "contentHash": "sha256:79e2978d134774168a5b534027caeb6709fe3ae8d18a97af21118982d07fb62e",
              "definition": "Canonical directed adjacency including isolated nodes, modulo node relabeling; all source attributes excluded.",
              "id": "structural-canonical-observation-v1",
              "operation": "canonical-directed-structure-v1",
              "version": "1"
            },
            "units": "discrete-structure",
            "valueType": "canonical-directed-graph",
            "version": "1"
          },
          {
            "contentHash": "sha256:3df933040d1a5002b2338cf07b11eefd68e63f76597e72873d897fd3ea86efd3",
            "definition": "Canonical directed adjacency with all five declared edge fields under one common node bijection; ID arrays are sets, and code meanings require the vocabulary policy.",
            "id": "canonical-typed-directed-structure-v1",
            "mandatory": true,
            "normalization": "none",
            "requiredEvidence": [
              "verified-scoped-directed-projection",
              "complete-declared-edge-types",
              "bound-local-dictionaries",
              "compatible-vocabulary-for-comparison"
            ],
            "schemaVersion": "1",
            "scope": "whole-scoped-directed-graph",